{
  "id": "CreamFinance-20210830",
  "date": "2021-08-30",
  "title": "Cream Finance Reentrancy Attack",
  "protocol": "Cream Finance",
  "blockchain": [
    "ethereum"
  ],
  "category": [
    "reentrancy",
    "flashloan"
  ],
  "ecosystem": "evm",
  "language": [
    "solidity"
  ],
  "estimatedLoss": {
    "totalUSD": "18800000",
    "breakdown": [
      {
        "asset": "ETH",
        "amount": "6000",
        "convertedUSD": "18800000"
      }
    ],
    "note": "Approximately 6,000 ETH stolen across 17 exploit transactions, valued at ~$18.8M at time of hack (ETH ~$3,130). Loss also included 418,311,571 AMP tokens from the Cream AMP market. The stolen ETH remained in the attacker's address at the time of reporting."
  },
  "attackTime": {
    "startTime": "2021-08-30T03:50:26Z",
    "endTime": "2021-08-30T06:29:43Z",
    "isRange": true,
    "note": "Attack began with deployment of first exploit contract at 03:50:26 UTC. Main exploit window (approximately 17 attack transactions) ran from ~04:03 UTC to ~05:44 UTC, using multiple sequentially deployed exploit contracts. The final exploit transaction at ~05:44 UTC deployed Attack Contract A (0x38c40427...) which internally created Contract B (0x0ec306d7...). Post-exploit token swaps and fund consolidation continued until ~06:29 UTC.",
    "date": "2021-08-30"
  },
  "description": "On August 30, 2021, Cream Finance was exploited for approximately $18.8 million (~6,000 ETH) through a reentrancy attack involving the AMP token contract. The attacker deployed approximately 18 custom exploit contracts and executed around 17 exploit transactions using flash loans from dYdX. Each deployed contract executed one attack cycle: (1) take a 500 WETH flash loan from dYdX and deposit as collateral on Cream, minting ~24,170 crETH; (2) borrow ~19.48M AMP against the crETH; (3) exploit the reentrancy bug in AMP's transfer() to borrow an additional 355 ETH before the first borrow() state update; (4) internally create or use a secondary contract to partially liquidate the primary contract's loan, redeeming ~187 WETH; and (5) repay the flash loan, netting ~41 ETH and ~9.74M AMP per cycle. The final exploit transaction used Attack Contract A (0x38c40427...), which internally created Contract B (0x0ec306d7...). Cream Finance's lending protocol lacked reentrancy protection on its borrow/lend functions. The AMP token contract (0xff208177...) implemented ERC777-style hooks via ERC1820 with _callPreTransferHooks, introducing the reentrancy vulnerability. Cream had been audited by Trail of Bits on January 28, 2021, but the AMP token was added as a collateral asset via a community proposal on February 10, 2021, after the audit. The stolen funds remained in the attacker's EOA address (0xce1f4b4f...) at the time of reporting.",
  "transactions": [
    {
      "txHash": "0x478d724da4e6125c889053ccf6068ed0f8f8013dd20bc80bab6a203542c3f93d",
      "role": "deploy",
      "description": "Deploy of first exploit contract (0xbd51cb8c...) at block 13124538 (03:50:26 UTC). This was the first in a series of approximately 18 contracts deployed by the attacker.",
      "blockchain": "ethereum"
    },
    {
      "txHash": "0x0016745693d68d734faa408b94cdf2d6c95f511b50f47b03909dc599c1dd9ff6",
      "role": "setup",
      "description": "Call to first exploit contract at block 13124591 (04:03:40 UTC). Initiates the first attack cycle against Cream's AMP market.",
      "blockchain": "ethereum"
    },
    {
      "txHash": "0x454753361f29e90c1974f885d43885183112d8b511614387606bb696126f6bd8",
      "role": "deploy",
      "description": "Deploy of another exploit contract (0x862c8b2e...) at block 13124615 (04:07:58 UTC). One of approximately 18 sequentially deployed contracts used across the attack.",
      "blockchain": "ethereum"
    },
    {
      "txHash": "0xcb16bb40a7b4d2174d3e2b05ed037ae3a8ac71f1f53fe0545c7eb267900c9e85",
      "role": "prepare",
      "description": "Token swap via 1inch aggregator at block 13124745 (04:33:08 UTC). Intermediate asset acquisition between exploit cycles.",
      "blockchain": "ethereum"
    },
    {
      "txHash": "0xc1b523bbf29861c8737a22459f0c973aea923098f353fb3718994ec756c35ee9",
      "role": "deploy",
      "description": "Deploy of Attack Contract A (0x38c40427...) at block 13125064 (05:42:59 UTC). The final exploit contract used in the attack sequence. This contract would internally create Contract B (0x0ec306d7...) during the subsequent exploit transaction.",
      "blockchain": "ethereum"
    },
    {
      "txHash": "0xa9a1b8ea288eb9ad315088f17f7c7386b9989c95b4d13c81b69d5ddad7ffe61e",
      "role": "exploit",
      "description": "Final exploit transaction at block 13125071 (2021-08-30 05:44:47 UTC). Attack Contract A takes flash loan of 500 WETH from dYdX, deposits as collateral on Cream minting 24,170 crETH, borrows 19.48M AMP, then exploits AMP token reentrancy to borrow an additional 355 ETH before the first borrow() state update. Contract B is internally created by Contract A during this transaction, funded with 9.74M AMP to partially liquidate Contract A's loan, redeeming 187 WETH. Profit: 41 ETH + 9.74M AMP. One of ~17 exploit transactions executed across multiple deployed contracts.",
      "blockchain": "ethereum"
    },
    {
      "txHash": "0x7df47235a039d10022aa3a5d6408206fd9641669fc3152ea8610a641215bdf2e",
      "role": "consolidation",
      "description": "Token swap via 1inch at block 13125124 (05:58:24 UTC). Consolidation of stolen assets through DEX aggregation.",
      "blockchain": "ethereum"
    },
    {
      "txHash": "0xc16c686fcd76cea925ce0c6892858aa78690c231404f38e5f203872058299076",
      "role": "consolidation",
      "description": "Uniswap v3 swap at block 13125243 (06:26:30 UTC). Final consolidation of stolen assets through Uniswap.",
      "blockchain": "ethereum"
    }
  ],
  "attackers": [
    {
      "address": "0xce1f4b4f17224ec6df16eeb1e3e5321c54ff6ede",
      "role": "primary_attacker",
      "description": "Primary attacker EOA that deployed exploit contracts, executed 17 exploit transactions, and accumulated ~6,000 ETH in stolen funds. At the time of reporting, the stolen ETH remained in this address.",
      "accountType": "EOA",
      "blockchain": "ethereum"
    },
    {
      "address": "0x38c40427efbaae566407e4cde2a91947df0bd22b",
      "role": "exploit_contract",
      "description": "Attack Contract A. Used to take flash loan of 500 WETH from dYdX, deposit as collateral on Cream, borrow AMP, and exploit reentrancy to extract additional ETH.",
      "accountType": "Contract",
      "blockchain": "ethereum"
    },
    {
      "address": "0x0ec306d7634314d35139d1df4a630d829475a125",
      "role": "exploit_contract",
      "description": "Attack Contract B. Funded with half of the AMP tokens borrowed by Contract A, used to partially liquidate Contract A's loan and redeem WETH back to Contract A, completing the profit extraction cycle.",
      "accountType": "Contract",
      "blockchain": "ethereum"
    }
  ],
  "victims": [
    {
      "address": "0xff20817765cb7f73d4bde2e66e067e58d11095c2",
      "role": "vulnerable_token",
      "description": "AMP token contract. Implements ERC777-style hooks via ERC1820 with _callPreTransferHooks, which introduced a reentrancy vulnerability. The token contract's transfer() function could call back into Cream's borrow() function before state updates were completed.",
      "accountType": "Contract",
      "blockchain": "ethereum"
    },
    {
      "address": "0xD06527D5e56A3495252A528C4987003b712860eE",
      "role": "protocol_contract",
      "description": "crETH (Cream Ether) market contract. Used by the attacker as collateral (minted crETH by depositing WETH from flash loan) to borrow AMP against.",
      "accountType": "Contract",
      "blockchain": "ethereum"
    },
    {
      "address": "0x3d5BC3c8d13dcB8bF317092d84783c2697AE9258",
      "role": "protocol_contract",
      "description": "Cream Finance Unitroller/Comptroller. The core lending protocol contract that lacked reentrancy protection on its borrow() function, allowing the nested reentrancy to succeed.",
      "accountType": "Contract",
      "blockchain": "ethereum"
    }
  ],
  "rootCause": "The Cream Finance lending protocol's borrow() function lacked reentrancy protection, and the AMP token contract implemented ERC777-style _callPreTransferHooks via ERC1820. When Cream's borrow() function transferred AMP tokens to the borrower, the AMP token's pre-transfer hook triggered a callback into the borrower's contract, which could then call Cream's borrow() function again before the first borrow() state update (balance changes, borrow index updates) had been committed. This allowed the attacker to borrow additional assets against the same collateral that had already been pledged, effectively creating an infinite borrow loop within a single transaction. The vulnerability was introduced after Cream's January 2021 Trail of Bits audit when the AMP token was added as a collateral asset on February 10, 2021, without adequate reentrancy safeguards.",